{
  "$schema": "../meta-schema.json",
  "message_type": "GET_POLYDAT",
  "type_id": "GET_POLYDAT",
  "introduced_in": "v1",
  "description": "Request the current POLYDATA mesh for the device named in the header.",
  "body_size": 0,
  "fields": [],
  "metadata_allowed": false,
  "see_also": [
    "POLYDATA"
  ]
}
