{
  "$schema": "../meta-schema.json",
  "message_type": "GET_QTDATA",
  "type_id": "GET_QTDATA",
  "introduced_in": "v1",
  "description": "Request the current QTDATA for the device named in the header.",
  "body_size": 0,
  "fields": [],
  "metadata_allowed": false,
  "see_also": [
    "QTDATA"
  ]
}
