{
  "$schema": "../meta-schema.json",
  "message_type": "GET_IMGMETA",
  "type_id": "GET_IMGMETA",
  "introduced_in": "v1",
  "description": "Request the IMGMETA listing. If the header device name is empty, a listing for all available images is returned.",
  "body_size": 0,
  "fields": [],
  "metadata_allowed": false,
  "see_also": [
    "IMGMETA",
    "IMAGE"
  ]
}
